{
  "evidenceVersion": 1,
  "rulesetVersion": "1.0.0",
  "adapter": {
    "id": "github.com",
    "version": "1"
  },
  "subject": {
    "accountId": "1001",
    "profileRepositoryId": "9001"
  },
  "evaluation": {
    "startedAt": "2026-10-15T23:50:00Z",
    "capturedThrough": "2026-10-16T00:10:00Z",
    "activityCutoffExclusive": "2026-10-15"
  },
  "binding": {
    "scopeId": "v1:sha256:57ef5775ba19f381c51f53fea413c885364935ea361c6f959d522197c9fd7c1b",
    "settingsHash": "v1:sha256:17a7a06e59bc623ee72dc24c262bc49906d70c731237f769fcf76d754829674e",
    "candidateLedgerHash": "v1:sha256:3ccd424a1be75c16bee41f748235528761a674c12519b826f2520142faab76c0",
    "previousLedgerHash": null
  },
  "policies": {
    "fileRules": {
      "mode": "inline",
      "id": "fixture-files-v1",
      "version": "1",
      "hash": "v1:sha256:3aed5256db8e22560d3c8ec16c5407683fbf207332a9fc6663e01ba8ada9722b",
      "body": {
        "version": "1",
        "exclusions": [
          {
            "kind": "generated",
            "patterns": [
              "fixture-generated/**"
            ]
          },
          {
            "kind": "lock",
            "patterns": [
              "fixture-locks/**"
            ]
          },
          {
            "kind": "card_update",
            "patterns": [
              "fixture-card/**"
            ]
          }
        ],
        "categories": [
          {
            "category": "deployment",
            "patterns": [
              "fixture-ops/**"
            ]
          },
          {
            "category": "test",
            "patterns": [
              "fixture-tests/**"
            ]
          },
          {
            "category": "documentation",
            "patterns": [
              "fixture-docs/**"
            ]
          },
          {
            "category": "source",
            "patterns": [
              "fixture-src/**"
            ]
          }
        ],
        "precedence": [
          "deployment",
          "test",
          "documentation",
          "source"
        ]
      }
    },
    "bugLabels": {
      "mode": "inline",
      "id": "fixture-bug-labels-v1",
      "version": "1",
      "hash": "v1:sha256:ff27c42afab0d2d2fe01b239dae29a889f9ae668e84a764968444780e4bd962f",
      "body": {
        "version": "1",
        "repositories": [
          {
            "repositoryId": "9001",
            "labelIds": [
              {
                "type": "numeric",
                "value": "601"
              }
            ]
          }
        ]
      }
    }
  },
  "collections": [
    {
      "ref": "root-repository-9001",
      "resourceType": "repository",
      "target": {
        "kind": "repository",
        "repositoryId": "9001"
      },
      "purpose": "metadata",
      "window": {
        "kind": "snapshot",
        "observedAt": "2026-10-15T00:58:00Z"
      },
      "filters": {},
      "state": "captured",
      "pages": [
        {
          "ref": "page-root-repository-9001",
          "sequence": 1,
          "capturedAt": "2026-10-15T00:58:00Z",
          "requestCursor": null,
          "response": {
            "status": "success",
            "httpStatus": 200,
            "itemRefs": [
              "repo-9001"
            ],
            "pagination": {
              "state": "end",
              "nextCursor": null
            },
            "truncation": "not_reported",
            "total": {
              "status": "provided",
              "value": 1
            }
          }
        }
      ]
    },
    {
      "ref": "root-pull-request-9001",
      "resourceType": "pull_request",
      "target": {
        "kind": "repository",
        "repositoryId": "9001"
      },
      "purpose": "activity",
      "window": {
        "kind": "interval",
        "startAt": "2026-07-17T00:00:00Z",
        "endAtExclusive": "2026-10-15T00:00:00Z"
      },
      "filters": {
        "states": "all"
      },
      "state": "captured",
      "pages": [
        {
          "ref": "page-root-pull-request-9001",
          "sequence": 1,
          "capturedAt": "2026-10-15T00:58:00Z",
          "requestCursor": null,
          "response": {
            "status": "success",
            "httpStatus": 200,
            "itemRefs": [],
            "pagination": {
              "state": "end",
              "nextCursor": null
            },
            "truncation": "not_reported",
            "total": {
              "status": "provided",
              "value": 0
            }
          }
        }
      ]
    },
    {
      "ref": "root-commit-9001",
      "resourceType": "commit",
      "target": {
        "kind": "repository",
        "repositoryId": "9001"
      },
      "purpose": "activity",
      "window": {
        "kind": "interval",
        "startAt": "2026-07-17T00:00:00Z",
        "endAtExclusive": "2026-10-15T00:00:00Z"
      },
      "filters": {
        "branch": "default"
      },
      "state": "captured",
      "pages": [
        {
          "ref": "page-root-commit-9001",
          "sequence": 1,
          "capturedAt": "2026-10-15T00:58:00Z",
          "requestCursor": null,
          "response": {
            "status": "success",
            "httpStatus": 200,
            "itemRefs": [],
            "pagination": {
              "state": "end",
              "nextCursor": null
            },
            "truncation": "not_reported",
            "total": {
              "status": "provided",
              "value": 0
            }
          }
        }
      ]
    },
    {
      "ref": "root-review-9001",
      "resourceType": "review",
      "target": {
        "kind": "repository",
        "repositoryId": "9001"
      },
      "purpose": "activity",
      "window": {
        "kind": "interval",
        "startAt": "2026-07-17T00:00:00Z",
        "endAtExclusive": "2026-10-15T00:00:00Z"
      },
      "filters": {
        "states": "all"
      },
      "state": "captured",
      "pages": [
        {
          "ref": "page-root-review-9001",
          "sequence": 1,
          "capturedAt": "2026-10-15T00:58:00Z",
          "requestCursor": null,
          "response": {
            "status": "success",
            "httpStatus": 200,
            "itemRefs": [],
            "pagination": {
              "state": "end",
              "nextCursor": null
            },
            "truncation": "not_reported",
            "total": {
              "status": "provided",
              "value": 0
            }
          }
        }
      ]
    },
    {
      "ref": "root-release-9001",
      "resourceType": "release",
      "target": {
        "kind": "repository",
        "repositoryId": "9001"
      },
      "purpose": "activity",
      "window": {
        "kind": "interval",
        "startAt": "2026-07-17T00:00:00Z",
        "endAtExclusive": "2026-10-15T00:00:00Z"
      },
      "filters": {},
      "state": "captured",
      "pages": [
        {
          "ref": "page-root-release-9001",
          "sequence": 1,
          "capturedAt": "2026-10-15T00:58:00Z",
          "requestCursor": null,
          "response": {
            "status": "success",
            "httpStatus": 200,
            "itemRefs": [],
            "pagination": {
              "state": "end",
              "nextCursor": null
            },
            "truncation": "not_reported",
            "total": {
              "status": "provided",
              "value": 0
            }
          }
        }
      ]
    },
    {
      "ref": "root-issue-event-9001",
      "resourceType": "issue_event",
      "target": {
        "kind": "repository",
        "repositoryId": "9001"
      },
      "purpose": "activity",
      "window": {
        "kind": "interval",
        "startAt": "2026-07-17T00:00:00Z",
        "endAtExclusive": "2026-10-15T00:00:00Z"
      },
      "filters": {
        "actions": "triage"
      },
      "state": "captured",
      "pages": [
        {
          "ref": "page-root-issue-event-9001",
          "sequence": 1,
          "capturedAt": "2026-10-15T00:58:00Z",
          "requestCursor": null,
          "response": {
            "status": "success",
            "httpStatus": 200,
            "itemRefs": [],
            "pagination": {
              "state": "end",
              "nextCursor": null
            },
            "truncation": "not_reported",
            "total": {
              "status": "provided",
              "value": 0
            }
          }
        }
      ]
    }
  ],
  "resources": {
    "repositories": [
      {
        "ref": "repo-9001",
        "repositoryId": "9001",
        "captureRefs": [
          "page-root-repository-9001"
        ],
        "sourceId": {
          "type": "numeric",
          "value": "9001"
        },
        "owner": {
          "status": "identified",
          "accountId": "1001",
          "type": "User"
        },
        "visibility": "public",
        "fork": false,
        "observedAt": "2026-10-15T00:58:00Z",
        "defaultBranch": "main"
      }
    ],
    "pullRequests": [],
    "commits": [],
    "reviews": [],
    "releases": [],
    "issues": [],
    "issueEvents": [],
    "fileChanges": []
  }
}
