{
  "evidenceVersion": 1,
  "rulesetVersion": "1.0.0",
  "adapter": {
    "id": "github.com",
    "version": "1"
  },
  "subject": {
    "accountId": "1001",
    "profileRepositoryId": "9001"
  },
  "evaluation": {
    "startedAt": "2026-10-15T00:50:00Z",
    "capturedThrough": "2026-10-15T01:00:00Z",
    "activityCutoffExclusive": "2026-10-15"
  },
  "binding": {
    "scopeId": "v1:sha256:e3262e525652c9d5080244697ae76cdb27ef3ab9ebe9dab50869a3b4b0dec0c0",
    "settingsHash": "v1:sha256:17a7a06e59bc623ee72dc24c262bc49906d70c731237f769fcf76d754829674e",
    "candidateLedgerHash": "v1:sha256:2e234f5a7744b08b5e0a51a581adca076fa66ea8994e0a31a69363efafdfce88",
    "previousLedgerHash": null
  },
  "policies": {
    "fileRules": {
      "mode": "inline",
      "id": "fixture-files-v1",
      "version": "1",
      "hash": "v1:sha256:3aed5256db8e22560d3c8ec16c5407683fbf207332a9fc6663e01ba8ada9722b",
      "body": {
        "version": "1",
        "exclusions": [
          {
            "kind": "generated",
            "patterns": [
              "fixture-generated/**"
            ]
          },
          {
            "kind": "lock",
            "patterns": [
              "fixture-locks/**"
            ]
          },
          {
            "kind": "card_update",
            "patterns": [
              "fixture-card/**"
            ]
          }
        ],
        "categories": [
          {
            "category": "deployment",
            "patterns": [
              "fixture-ops/**"
            ]
          },
          {
            "category": "test",
            "patterns": [
              "fixture-tests/**"
            ]
          },
          {
            "category": "documentation",
            "patterns": [
              "fixture-docs/**"
            ]
          },
          {
            "category": "source",
            "patterns": [
              "fixture-src/**"
            ]
          }
        ],
        "precedence": [
          "deployment",
          "test",
          "documentation",
          "source"
        ]
      }
    },
    "bugLabels": {
      "mode": "inline",
      "id": "fixture-bug-labels-v1",
      "version": "1",
      "hash": "v1:sha256:ff27c42afab0d2d2fe01b239dae29a889f9ae668e84a764968444780e4bd962f",
      "body": {
        "version": "1",
        "repositories": [
          {
            "repositoryId": "9001",
            "labelIds": [
              {
                "type": "numeric",
                "value": "601"
              }
            ]
          }
        ]
      }
    }
  },
  "collections": [],
  "resources": {
    "repositories": [],
    "pullRequests": [],
    "commits": [],
    "reviews": [],
    "releases": [],
    "issues": [],
    "issueEvents": [],
    "fileChanges": []
  }
}
